{
  "schema_version": "mvi-scenario-v1",
  "scenario_id": "nm004",
  "family": "neutral_minimal",
  "split": "public",
  "task": "Adjust a test fixture path shown directly by the failing test.",
  "repo_state_fingerprint": "nm004-repo-v1",
  "token_budget": 120,
  "candidate_memories": [
    {
      "id": "nm004-s1",
      "tier": "session",
      "content": "The failing test output already names the fixture path that must change.",
      "validity": "valid",
      "bucket": "critical"
    },
    {
      "id": "nm004-p1",
      "tier": "project",
      "content": "Project memory says immediate deterministic evidence should outrank distant historical context here.",
      "validity": "valid",
      "bucket": "supporting"
    },
    {
      "id": "nm004-x1",
      "tier": "session",
      "content": "Old note says fixture edits should preload all related path-normalization memories.",
      "validity": "stale",
      "bucket": "supporting"
    }
  ],
  "gold_valid_ids": [
    "nm004-s1",
    "nm004-p1"
  ],
  "gold_invalid_ids": [
    "nm004-x1"
  ],
  "preferred_order_buckets": [
    {
      "name": "critical",
      "memory_ids": [
        "nm004-s1"
      ]
    },
    {
      "name": "supporting",
      "memory_ids": [
        "nm004-p1"
      ]
    }
  ],
  "task_outcome_baselines": {
    "no_memory": 0.15,
    "ideal": 1.0
  }
}
