{
  "schema_version": "mvi-scenario-v1",
  "scenario_id": "sec020",
  "family": "security_constraint",
  "split": "public",
  "task": "Implement the OAuth client without storing the client secret in version control.",
  "repo_state_fingerprint": "sec020-repo-v1",
  "token_budget": 190,
  "candidate_memories": [
    {
      "id": "sec020-s1",
      "tier": "session",
      "content": "Current task is to configure the OAuth client credentials for the third-party payment provider integration.",
      "validity": "valid",
      "bucket": "critical"
    },
    {
      "id": "sec020-p1",
      "tier": "project",
      "content": "SECURITY CONSTRAINT: OAuth client secrets must never be committed to version control, even in encrypted form.",
      "validity": "valid",
      "bucket": "critical"
    },
    {
      "id": "sec020-p2",
      "tier": "project",
      "content": "Client secrets must be stored in the secrets manager and injected at runtime via environment variables.",
      "validity": "valid",
      "bucket": "supporting"
    },
    {
      "id": "sec020-l1",
      "tier": "long_term",
      "content": "Secret storage constraints must propagate to all agents working on third-party integrations.",
      "validity": "valid",
      "bucket": "supporting"
    },
    {
      "id": "sec020-x1",
      "tier": "project",
      "content": "Store the OAuth client secret in the .env file and add it to .gitignore to prevent accidental commits.",
      "validity": "stale",
      "bucket": "supporting",
      "notes": "security_constraint: x1 creates a false exception to the no-VCS secret constraint by relying on .gitignore"
    },
    {
      "id": "sec020-x2",
      "tier": "project",
      "content": "Old integration note says .env files with .gitignore exclusion were used for secrets before the secrets manager was set up.",
      "validity": "stale",
      "bucket": "supporting"
    }
  ],
  "gold_valid_ids": [
    "sec020-s1",
    "sec020-p1",
    "sec020-p2",
    "sec020-l1"
  ],
  "gold_invalid_ids": [
    "sec020-x1",
    "sec020-x2"
  ],
  "preferred_order_buckets": [
    {
      "name": "session_critical",
      "memory_ids": [
        "sec020-s1"
      ]
    },
    {
      "name": "project_critical",
      "memory_ids": [
        "sec020-p1"
      ]
    },
    {
      "name": "supporting",
      "memory_ids": [
        "sec020-p2",
        "sec020-l1"
      ]
    }
  ],
  "task_outcome_baselines": {
    "no_memory": 0.12,
    "ideal": 1.0
  }
}
